{
  "$schema": "https://json-schema.org/draft/2020-12/schema",
  "$id": "https://allagma.org/contracts/0.2/ClaimRecord",
  "title": "ClaimRecord",
  "type": "object",
  "properties": {
    "schema_version": {
      "const": "0.2"
    },
    "record_type": {
      "const": "ClaimRecord"
    },
    "claim_id": {
      "type": "string",
      "minLength": 1
    },
    "text": {
      "type": "string",
      "minLength": 1
    },
    "supporting": {
      "type": "array",
      "items": {
        "type": "object",
        "properties": {
          "path": {
            "type": "string",
            "minLength": 1
          },
          "sha256": {
            "type": "string",
            "pattern": "^[a-f0-9]{64}$"
          },
          "media_type": {
            "type": "string",
            "minLength": 1
          },
          "retention": {
            "type": "string",
            "minLength": 1
          }
        },
        "required": [
          "path",
          "sha256",
          "media_type",
          "retention"
        ],
        "additionalProperties": false
      }
    },
    "contradicting": {
      "type": "array",
      "items": {
        "type": "object",
        "properties": {
          "path": {
            "type": "string",
            "minLength": 1
          },
          "sha256": {
            "type": "string",
            "pattern": "^[a-f0-9]{64}$"
          },
          "media_type": {
            "type": "string",
            "minLength": 1
          },
          "retention": {
            "type": "string",
            "minLength": 1
          }
        },
        "required": [
          "path",
          "sha256",
          "media_type",
          "retention"
        ],
        "additionalProperties": false
      }
    },
    "dependencies": {
      "type": "array",
      "items": {
        "type": "object",
        "properties": {
          "path": {
            "type": "string",
            "minLength": 1
          },
          "sha256": {
            "type": "string",
            "pattern": "^[a-f0-9]{64}$"
          },
          "media_type": {
            "type": "string",
            "minLength": 1
          },
          "retention": {
            "type": "string",
            "minLength": 1
          }
        },
        "required": [
          "path",
          "sha256",
          "media_type",
          "retention"
        ],
        "additionalProperties": false
      }
    },
    "scope": {
      "type": "string",
      "minLength": 1
    },
    "limitations": {
      "type": "array",
      "items": {
        "type": "string",
        "minLength": 1
      }
    },
    "status": {
      "enum": [
        "supported",
        "contradicted",
        "inconclusive",
        "stale"
      ]
    },
    "supersedes": {
      "type": [
        "string",
        "null"
      ]
    }
  },
  "required": [
    "schema_version",
    "record_type",
    "claim_id",
    "text",
    "supporting",
    "contradicting",
    "dependencies",
    "scope",
    "limitations",
    "status",
    "supersedes"
  ],
  "additionalProperties": false
}
